Hotel Names,Ratings,Number of Reviews,Prices,links,location,Description
84. Ismailia House Hotel,3.5 of 5 bubbles,22 reviews,EGP 536EGP 467,https://www.tripadvisor.in/Hotel_Review-g294201-d1126089-Reviews-Ismailia_House_Hotel-Cairo_Cairo_Governorate.html,"1 El Tahrir Sq. Downtown, Cairo 11511 Egypt","I love this little hotel. I often stayed there as a single woman in Cairo, and they always took good care of me! I have spent hundreds of days there over the last 30 years. I spent a lot of 2020 here, as my apartment was being renovated. The staff made me feel it was my second home.  The hotel is thoroughly cleaned every day. It was redecorated in the last couple years. The building is 1920s style, with high ceilings, balconies with great views of the city, ceiling fans, and lots of charm. The old, original elevator works well--it might take some getting used to, but it is regularly maintained, so you can count on it. If it ever does not work once, the owner gets it checked right away, because he won't be able to stay in business without it. If you find the stairways dirty or the airshaft dirty--these things are typical in Egypt and not something the hotel can do anything about, since they own the eighth floor, but not the building.  The owner, Ashraf, is very kind and accommodating to your needs, as well as an excellent source of information about any where you need to go, how to renew your visa, how to open a bank account, and whatever else you need. The staff are respectful and very honest.   Breakfast is bread, cheese and jam, plus an egg! Most budget places in Egypt don't include an egg. Cold drinks, water, tea and coffee are available at cheap prices. If you want to order a full Egyptian breakfast, it is excellent and not very expensive. Plus with the app ""Talabat,"" you can order from hundreds of area restaurants, if you don't feel like going out. Reception staff can help you order.  There are two suites with AC and a bathroom inside. The other rooms can some with a bathroo or you share the bathrooms, but many are available and cleaned multiple times a day. The bathtubs are clean, but old. It's time to redo the porcelain on them. But they work well and are clean.  You can hang out in the reception area to meet other travelers. They are mostly students, budget travelers an occasional businessman from Saudi. If you want any tour, Ashraf can arrange it, as well as transportation wherever you want, including the airport. He is very honest, which is sometimes not easy to find in Egypt.  The location is the best! Busses and a Metro stop are right in front of you, while taxis are plentiful and not expensive. There are new Uber busses or Svwl busses or cars you can book on apps for fair prices.  The balcony views of Tahrir Square, the Egyptian Museum or the old American University of Cairo campus are fantastic.  Bring earplugs, because Cairo never sleeps, so everywhere is noisy all night.…"
85. Al Nabila Cairo Hotel,3 of 5 bubbles,37 reviews,"EGP 2,088EGP 1,845",https://www.tripadvisor.in/Hotel_Review-g294201-d562498-Reviews-Al_Nabila_Cairo_Hotel-Cairo_Cairo_Governorate.html,"4 Gameat el-Dowal el-Arabiya Street, Cairo 11511 Egypt","If you’re looking for a hotel in Cairo, look no further than Al Nabila Cairo Hotel.For those interested in checking out popular landmarks while visiting Cairo, Al Nabila Cairo Hotel is located a short distance from Citadel (Al-Qalaa) (1.4 mi) and Zamalek (Gezira Island) (1.7 mi).Rooms at Al Nabila Cairo offer air conditioning and a minibar providing exceptional comfort and convenience.Room service and a concierge are some of the conveniences offered at this hotel. A pool and a lounge will also help to make your stay even more special.While visiting Cairo, you may want to try some falafel at one of the nearby restaurants, such as Felfela, Naguib Mahfouz Cafe, or Abou el-Sid.Looking to explore? Then look no further than Mosque of Al-Azhar (1.0 mi) and Sharia Al Mu'izz Li-Din Allah (0.9 mi), which are some popular Cairo attractions – all conveniently located within walking distance of the hotel.The staff at Al Nabila Cairo Hotel looks forward to serving you during your upcoming visit."
"Holiday Inn Cairo - Citystars, an IHG Hotel",4.5 of 5 bubbles,"1,089 reviews","EGP 3,727",https://www.tripadvisor.in/Hotel_Review-g294201-d817571-Reviews-Holiday_Inn_Cairo_Citystars_an_IHG_Hotel-Cairo_Cairo_Governorate.html,"Ali Rashed Street Heliopolis, Cairo 11757 Egypt","A modern, family-friendly hotel in Cairo's dynamic Citystars Heliopolis In the heart of Citystars business and leisure complex and just 10 minutes from Cairo International Airport, the Holiday Inn® Cairo Citystars hotel is an ideal base for exploring the modern and historic attractions of Egypt's capital. Next to the hotel, Stars Centre Mall is home to over 640 of shops and high-tech amusements including Snow City and Magic Galaxy, Egypt's largest indoor theme park. Downtown Cairo is less than half an hour away. The hotel's family-friendly atmosphere makes everyone feel at home, from the rooftop garden with its adults' and children's swimming pools, to the Star Corner Café in the lobby. Open 24-hours, Windows Restaurant tempts diners with heaped international buffets and live cooking stations, and Indira Restaurant serves some of the best Indian food in Cairo. Business travelers appreciate the fast, free Wi-Fi, business center and 24-hour room service. Need to hold a meeting?"
86. Helnan Landmark Hotel,3 of 5 bubbles,92 reviews,"EGP 3,409",https://www.tripadvisor.in/Hotel_Review-g294201-d2708288-Reviews-Helnan_Landmark_Hotel-Cairo_Cairo_Governorate.html,"Plot 86, 90th Street, 5th Settlement, Cairo 10240 Egypt","If you’re looking for a family-friendly small hotel in Cairo, look no further than Helnan Landmark Hotel.Rooms at Helnan Landmark Hotel provide air conditioning and a refrigerator, and guests can stay connected with free wifi.In addition, while staying at Helnan Landmark Hotel guests have access to room service. You can also enjoy a pool and free breakfast.If you’re looking for a seafood restaurant, consider a visit to The Smokery, which is not far from Helnan Landmark Hotel.Looking for something to do in Cairo? Picasso East art gallery (1.0 mi) is a popular attraction that is within walking distance of Helnan Landmark Hotel.The staff at Helnan Landmark Hotel looks forward to serving you during your upcoming visit."
87. Hotel Velvet 1928,3.5 of 5 bubbles,34 reviews,"EGP 1,169",https://www.tripadvisor.in/Hotel_Review-g294201-d15073383-Reviews-Hotel_Velvet_1928-Cairo_Cairo_Governorate.html,"8 Gawad Housny Street, Cairo 11511 Egypt","HOTEL VELVET 1928 IS LOCATED IN THE HEART OF CAIRO DOWNTOWN, FEW MINUTES WALKING FROM THE EGYPTIAN MUSEUM, AND THE RIVER NILE. SURROUNDED BY RESTAURANTS, CAFES AND SHOPS THE BUILDING Majestic 1928 beauty of THE ITALIAN Architect Anton lachec EVERY ROOM IS OCCUPIED WITH DIFFERENT FRENCH CHANDELIERS DATED TO THE YEAR 1910, ALL ROOM ARE OCCUPIED WITH PRIVATE TOILETS, A\C AND PLASMA TV"
88. Royal Marshal Hotel,3 of 5 bubbles,28 reviews,"EGP 1,683",https://www.tripadvisor.in/Hotel_Review-g294201-d308098-Reviews-Royal_Marshal_Hotel-Cairo_Cairo_Governorate.html,"4A El Khalifa El Maamoun Street Heliopolis, Cairo 11511 Egypt","If you’re looking for a budget friendly hotel in Cairo, look no further than Royal Marshal Hotel.For those interested in checking out popular landmarks while visiting Cairo, Royal Marshal Hotel is located a short distance from Heliopolis (1.7 mi) and St. Mark's Coptic Orthodox Church (1.8 mi).You’ll enjoy relaxing rooms that offer air conditioning and a minibar, and you can stay connected during your stay as Royal Marshal Hotel offers guests free wifi.The hotel features 24 hour front desk, room service, and a concierge. Plus, Royal Marshal Hotel offers a rooftop pool and a lounge, providing a pleasant respite from your busy day. For guests with a vehicle, street parking is available.If you’re looking for a sushi restaurant, consider a visit to Sachi Restaurant, Shogun Japanese Restaurant, or The Smokery Heliopolis, which are all conveniently located a short distance from Royal Marshal Hotel.Cairo is also known for some great historic sites, including Saqqara (Sakkara) Pyramids, Mohamed Ali Mosque, and Citadel (Al-Qalaa), which are not too far from Royal Marshal Hotel.The staff at Royal Marshal Hotel looks forward to serving you during your upcoming visit."
89. Salma Hotel,2.5 of 5 bubbles,20 reviews,EGP 782,https://www.tripadvisor.in/Hotel_Review-g294201-d302717-Reviews-Salma_Hotel-Cairo_Cairo_Governorate.html,"12 Mohamed Kamel Morsy St. off Al Battel Ahmed Abdel Aziz St. Gamet Al Dwal Alarbia St. Mohandssin, Cairo 11511 Egypt","Salma Hotel is your smart choice with Three stars hotel located in Mohandssin,Giza,Egypt , 54 Air condition rooms Free WiFi all over the hotel including rooms, Free Breakfast, Free 24 room service, Free parking, Restaurant, Cafe, Laundry,LED Screens, Airport shuttle service,Concierge service."
90. Prime Residence New Cairo,5 of 5 bubbles,22 reviews,,https://www.tripadvisor.in/Hotel_Review-g294201-d15726552-Reviews-Prime_Residence_New_Cairo-Cairo_Cairo_Governorate.html,"176 Al Sharq Insurance Buildings, Fifth Settlement, Cairo 11511 Egypt","At Prime Residences, we want to anticipate everything you need and require to make your stay an absolute pleasure. Our residences are built for movers and shakers, established in the prime business districts. We want you to be in the heart of the action, close to the pulse of what matters most supported by our discreet, personal services and elegant lifestyle offerings around the Nation. Our properties are designed to make our guests’ stay extra convenient, providing concierge and security services in addition to housekeeping and laundry. Offering apartment types ranging from studios to spectacular 2 bedroom apartments. We offer superb locations, facilities and services; guests choose to stay at Prime for leisure, corporate, and business stays. Prime promise to guests is that they are guaranteed to feel at home. We are a hospitality brand that guarantees a premium stay experience through a combination of high-touch services, mobile technology, and state-of-the-art facilities. Our stylish modern serviced Studios (50 sqm) in New Cairo City are perfect for leisure or business guests looking for excellent value apartments. Only few minutes away from a number of luxurious shopping malls, our guests are in excellent location to enjoy myriad of restaurants, cafés and cinemas. Studios are fully furnished including an open space with a queen bed and soft linens, modern fully equipped kitchenette featuring fridge, stovetop and microwave, and bathroom includes towels and amenities. Prime Residence offers Studios, 1 bedroom and 2 bedrooms apartments for short and long stays. We offer 24/7 front office and concierge services; to take care of any needs you may have during your stay. Housekeeping, laundry and maintenance services are also available ensuring your home is kept in perfect condition so that you are able to enjoy your stay. Wanting to keep in touch? You can use the the free Wi-Fi connection available in your new home. Our residence offers guests car parking and a free gym for residents only"
"InterContinental Cairo Semiramis, an IHG Hotel",4.5 of 5 bubbles,"2,840 reviews","EGP 5,987",https://www.tripadvisor.in/Hotel_Review-g294201-d299113-Reviews-InterContinental_Cairo_Semiramis_an_IHG_Hotel-Cairo_Cairo_Governorate.html,"Corniche El Nil, Cairo 11511 Egypt","On the historic Semiramis hotel site, guests can enjoy modern luxury by the river Nile. Semiramis InterContinental Cairo is 23 KM from Cairo International airport with a premium location in the heart of the city center next to the Egyptian Museum and Khan el Khalili. The Hotel features a 26 sq m2 rooftop pool, fine dining with exquisite cuisine, conference facilities, a state of the art spa, a shopping arcade, and the Nile Terrace offering stunning views of the sunset over the Nile."
91. The Australian Hostel,4.5 of 5 bubbles,291 reviews,EGP 989EGP 878,https://www.tripadvisor.in/Hotel_Review-g294201-d1065915-Reviews-The_Australian_Hostel-Cairo_Cairo_Governorate.html,"23 Abd El Khalek Tharwat St Downtown, 3rd floor, Cairo 11511 Egypt","Located in the heart of Cairo city centre, this budget hostel is a 10-minute walk from the Egyptian Museum. It has a 24-hour front desk, communal room and free Wi-Fi. Rooms at The Australian Hostel have air conditioning, a tea/coffee maker and a private or shared bathroom. Some rooms have a balcony. Guests can enjoy an Egyptian or continental breakfast in the mornings. The Australian's communal kitchen allows guests to cook their own meals. The oriental-style communal room equipped with comfortable couches and a coffee table is a nice place to meet other travelers. The Australian Hostel's staff can help arrange tours of Cairo city centre, local museums and the Pyramids. They also provide maps and sightseeing brochures. The Australian is a 15-minute walk from the Railway Station."
92. Holy Sheet Hostel,5 of 5 bubbles,60 reviews,"EGP 1,129",https://www.tripadvisor.in/Hotel_Review-g294201-d15696833-Reviews-Holy_Sheet_Hostel-Cairo_Cairo_Governorate.html,"2 Al Qadi Al Fadel 2nd Floor, Cairo 11511 Egypt","Greetings from Holy Sheet Hostel! Downtown Cairo is your destination if you want to be in the heart of action watching Cairo’s street life and accessing easily to everything and everywhere; So, we have chosen, prepared and well-designed this cozy place to stay – Holy Sheet Hostel – for you in an ideal central location, in the heart of the city. Just minutes from Talat Harb square, Tahrir square and The Egyptian Museum; Just minutes to restaurants, lively coffee shops, markets, spirits stores, bank & exchange shops, etc. Just minutes to bus, subway and train stations. Holy Sheet Hostel offers safe, clean, quiet, quality accommodation for single travelers, couples and groups (small & large ones). We offer large range of rooms from Mixed & Female Bunk-Bed (with privacy curtains, power sockets and lights) dorms, to private rooms with access to shared bathrooms and private rooms with en-suite bathrooms. Holy Sheet Hostel offers cozy hangout area for socializing and sharing experiences with other travelers; provided with Netflix access and PlayStation4. We offer a fully communal equipped kitchen ready to be used around the clock. HOLY SHEET hostel: *No curfew *24/7 Reception *Air-Conditioned rooms *Laundy & Drying Service *Luggage storage is available *Hairdryers available for free use *Bed linen and towels are provided *Free WiFi covering throughout the hostel *Breakfast is included; is served from 8AM to 12PM *Payment upon arrival by cash (EGP, USD, Euro or GBP), Credit, Debit Cards *We provide 24/7 airport transfers in private cars; At extra charge; To request: send an e-mail. *Our team is ready to make your stay easier by providing you with all information you need, helping you to plan your wish trips throughout Egypt."
93. Cairo Hub Hostel,5 of 5 bubbles,62 reviews,"EGP 1,138EGP 1,016",https://www.tripadvisor.in/Hotel_Review-g294201-d21080139-Reviews-Cairo_Hub_Hostel-Cairo_Cairo_Governorate.html,"11 Tahrir Square 4th Floor, Cairo 11511 Egypt","It's really an oasis in the middle of the desert name Cairo, beautiful view and the staff has a really nice team who will give you really good advice and want you to enjoy every minute of your travel ! I recommend the place for every canadian ! The others you got to find out yourself but speaking for myself, I will be back if I got the occasion !"
94. Horus House Hotel,4 of 5 bubbles,60 reviews,"EGP 2,057EGP 1,905",https://www.tripadvisor.in/Hotel_Review-g294201-d940276-Reviews-Horus_House_Hotel-Cairo_Cairo_Governorate.html,"21 Ismail Muhammad, Cairo Egypt","Horus House Hotel, a 3 stars hotel offers air-conditioned rooms with LCD TV and free Wi-Fi. Buffet breakfast, an outdoor terrace and ticket service are available.Horus House Hotel’s rooms each have satellite TV and a work desk. A minibar is also provided, and guests can order in-room breakfast and room service.The staff at Horus House’s 24-hour front desk are available to assist with currency exchange or airport shuttle arrangements. Express check-in/check-out is also offered.Hot buffet breakfast is available each day, and guests can enjoy a drink on hotel Horus House’s outdoor terrace.Located in Cairo’s quiet Zamalek district, Horus House Hotel is 1 mile from both Ramses Train Station and Gezira subway station."
95. Carlton Hotel,3.5 of 5 bubbles,36 reviews,"EGP 1,680",https://www.tripadvisor.in/Hotel_Review-g294201-d562833-Reviews-Carlton_Hotel-Cairo_Cairo_Governorate.html,"21-26 July Street Oraby, Downtown, Cairo 11511 Egypt","Finding an ideal budget friendly hotel in Cairo does not have to be difficult. Welcome to Carlton Hotel, a nice option for travellers like you.Guest rooms offer amenities such as air conditioning, a minibar, and a desk, and guests can go online with free wifi offered by the hotel.Carlton Hotel features 24 hour front desk, room service, and a concierge, to help make your stay more enjoyable. The property also boasts a lounge. If you are driving to Carlton Hotel, parking is available.Nearby landmarks such as Mosque of Al-Azhar (0.7 mi) and Islamic Cairo (1.7 mi) make Carlton Hotel a great place to stay when visiting Cairo.While visiting Cairo, you may want to try some falafel at one of the nearby restaurants, such as Felfela, Naguib Mahfouz Cafe, or Abou el-Sid.Looking to explore? Then look no further than Cairo Tower (1.1 mi) and Zamalek (Gezira Island) (0.9 mi), which are some popular Cairo attractions – all conveniently located within walking distance of the hotel.Carlton Hotel puts the best of Cairo at your fingertips, making your stay both relaxing and enjoyable."
Fairmont Nile City,4.5 of 5 bubbles,"5,393 reviews","EGP 4,838",https://www.tripadvisor.in/Hotel_Review-g294201-d580690-Reviews-Fairmont_Nile_City-Cairo_Cairo_Governorate.html,"Nile City Towers - 2005 B, Corniche El Nil Ramlet Beaulac, Cairo 2466 Egypt","A melting pot of history and diversity, the city of Cairo is ideal for both business and leisure. Like the city itself, Fairmont Nile City offers a delightful series of contrasts, combining advanced technology and modern design with local flavors and flair. With sweeping panoramas of the river Nile and the Pyramids in the distance, Cairo’s beauty and history are always in sight from your luxury accommodation. During your stay, embark on culinary adventures at the city’s finest restaurants, enjoy the fresh air at our rooftop poolside restaurant and pamper yourself at Willow Stream Spa. Part of the prestigious Nile City complex, this luxury hotel is the perfect location for business events. The space consists of 845 square meters (9,100 square feet) plus 450 square meters (4,800 square feet) of outdoor space dedicated to meetings and conventions, comprising of 10 meeting rooms including a ballroom. The space also offers spectacular river Nile views."
96. Atlas International Hotels,3.5 of 5 bubbles,6 reviews,"EGP 1,320",https://www.tripadvisor.in/Hotel_Review-g294201-d17467692-Reviews-Atlas_International_Hotels-Cairo_Cairo_Governorate.html,"2 Mohamed Roushdi Street Abdeen, Cairo 11511 Egypt","Featuring a bar called The Hybrid lounge, Atlas International Hotels is located in Cairo in the Cairo Governorate region, 0.9 mi from Khan Al Khalili and 1.1 mi from Tahrir Square. Among the facilities of this property are a restaurant, a 24-hour front desk and a concierge service, along with free WiFi throughout the property. The hotel features family rooms. At the hotel, every room is fitted with a wardrobe. Complete with a private bathroom equipped with a bath, all units at Atlas International Hotels have a flat-screen TV and air conditioning, and some rooms will provide you with a seating area. A buffet breakfast is available daily at the accommodations. Atlas International Hotels offers a terrace. Al-Azhar Mosque is 1.1 mi from the hotel, while El Hussien Mosque is 1.7 mi away. The nearest airport is Cairo International, 11 mi from Atlas International Hotels, and the property offers a paid airport shuttle service."
97. Arabian Nights,4 of 5 bubbles,122 reviews,EGP 576,https://www.tripadvisor.in/Hotel_Review-g294201-d1201661-Reviews-Arabian_Nights-Cairo_Cairo_Governorate.html,"10 Al Aded St off of Mansouria Street Darassa, Islamic Cairo, Cairo 11511 Egypt","We are proud to have won the TripAdvisor 2012 Award of Excellence. Come let our friendly, energetic staff help you discover the true charm of Cairo. Enjoy our clean, comfortable rooms, free breakfast, free wifi and complimentary hot drinks anytime on our gorgeous rooftop. We have thirty air-con rooms available with private bath and satellite TV. We also offer shared facilities. Members of our highly trained staff are fluent in both English and French. They are ready to facilitate your every need."
98. Capital Hotel,4 of 5 bubbles,45 reviews,"EGP 1,315",https://www.tripadvisor.in/Hotel_Review-g294201-d13356465-Reviews-Capital_Hotel-Cairo_Cairo_Governorate.html,"Kasr Al Nile St Behlar Passage Building Number 1, Cairo 99999 Egypt","See why so many travellers make Capital Hotel their small hotel of choice when visiting Cairo. Providing an ideal mix of value, comfort and convenience, it offers a family-friendly setting with an array of amenities designed for travellers like you.Given the close proximity of popular landmarks, such as Mosque of Al-Azhar (0.4 mi) and Mosque and Madrasa of Sultan Hassan (1.3 mi), guests of Capital Hotel can easily experience some of Cairo's most well known attractions.Rooms at Capital Hotel offer air conditioning, a minibar, and extra long beds providing exceptional comfort and convenience, and guests can go online with free wifi.24 hour front desk and room service are some of the conveniences offered at this small hotel.Cairo has plenty of Italian restaurants. So when you’re here, be sure to check out popular spots like Vivo Restaurant, Pane Vino Restaurant, and L'Uliveto Restaurant, which are serving up some great dishes.During your visit, be sure to check out popular attractions like Al-Azhar Park (1.1 mi) and Citadel (Al-Qalaa) (0.8 mi), which are all within walking distance of the small hotel.At Capital Hotel, your comfort and satisfaction come first, and they look forward to welcoming you to Cairo."
99. Kings Palace Hotel,3.5 of 5 bubbles,36 reviews,EGP 209,https://www.tripadvisor.in/Hotel_Review-g294201-d1081651-Reviews-Kings_Palace_Hotel-Cairo_Cairo_Governorate.html,"3 Ibrahim El Qabbani St Of Sabri Abu Alam St. Sapry Abo Alam-Talaat Harb Sq, Cairo 11511 Egypt",Single room with a private bathroom and A/C.
100. Cairo Moon Hotel,4.5 of 5 bubbles,97 reviews,EGP 819EGP 642,https://www.tripadvisor.in/Hotel_Review-g294201-d1841930-Reviews-Cairo_Moon_Hotel-Cairo_Cairo_Governorate.html,"28 Adly Street, Cairo 11511 Egypt","Our hotel offers all of the comforts of home in the center of downtown Cairo. Our colorfully designed, immaculately clean rooms are equipped with A/C or fan, and some offer a spacious balcony. We invite you to enjoy breakfast on our shaded terrace overlooking the city. We offer free hot drinks throughout the day and night, so you can relax and enjoy the view."
Sofitel Cairo Nile El Gezirah,4.5 of 5 bubbles,"3,918 reviews","EGP 5,122",https://www.tripadvisor.in/Hotel_Review-g294201-d304481-Reviews-Sofitel_Cairo_Nile_El_Gezirah-Cairo_Cairo_Governorate.html,"3 El Thawra Council St Zamalek, Cairo Egypt","On the southern tip of Gezirah Island, the hotel is a corner of paradise in central Cairo, minutes from Cairo’s business districts. Discover a haven of peace during a vacation in Egypt, and a comfortable base to rest after a successful day of business. Relax by the pool, pamper yourself in Sofitel SPA, wine and dine in our international restaurants and bars. Surrender to luxury and come for a day, a weekend, a week…or more. A stroll along the hotel’s lush riverside promenade takes you to a host of acclaimed restaurants and bars. You can take your time, enjoying the cool shade of exotic palms and breathing in the scent of hibiscus. You’ll hear the gentle sound of water lapping as you rest on a Nile-side terrace with a cool drink, and dine on international cuisine. It’s especially beautiful at dusk, when the sun sets over Cairo’s skyline and vibrant nightlife. Escape the city for a day at our secluded Cairo hotel, which feels like an exclusive Egyptian resort set in lush gardens. Take advantage of Sofitel SPA and Sofitel FIT, float in an infinity pool overlooking the Nile, unwind in a bubbling whirlpool bath… whatever you desire. Day membership includes discounts to the restaurants and bars which line the Nile-side promenade, promising refreshment and fun for families, couples and friends."
101. New City Hotel,4 of 5 bubbles,4 reviews,EGP 853,https://www.tripadvisor.in/Hotel_Review-g294201-d17464528-Reviews-New_City_Hotel-Cairo_Cairo_Governorate.html,"5 Talaat Harb Street, Tahrir Sq., Cairo 11511 Egypt","A 2-minute walk from Tahrir Square, New City Hotel is situated in Cairo and provides air-conditioned rooms. Featuring a bar, the hostel is close to several noted attractions, around a 6-minute walk from The Egyptian Museum and around 1.2 km from Cairo Tower. Khan Al Khalili is 2 km from the hostel. The units in the hostel are equipped with a kettle. Guest rooms will provide guests with a toaster. Guests at New City Hotel can enjoy a continental breakfast. Mosque of Ibn Tulun is 2.2 km from the accommodation. The nearest airport is Cairo International Airport, 17 km from New City."
