name,ratings,prices,aminities,location,description,City
Sphinx Palace Pyramids View,5.0,EGP 815,"Family rooms,Non-smoking rooms,Landmark view,City view,Mountain view,Bath / shower,Kitchenware,Electric kettle,Refrigerator,Oven,Dishwasher,Wake-up service / alarm clock,Tile / marble floor,Private bathrooms,Bottled water,Wardrobe / wardrobe,Sofa,Separate living room,Walk-in shower,Cable / satellite TV,Kitchenette,Coffee / tea maker,Seating area,Room service,Housekeeping,Air conditioning,Laundry service,Dry cleaning,Private check-in / check-out,Express check-in / check-out,Sun umbrellas,Sun terrace,Shared lounge / TV area,Shared kitchen,Picnic area,Mosquito net,Gift shop,Currency exchange,Baggage storage,Taxi service,Car hire,Breakfast available,Wifi,24-hour check-in,24-hour security,Rooftop terrace,Airport transportation,Pets Allowed ( Dog / Pet Friendly ),Free breakfast,Free High Speed Internet (WiFi),Free parking,","Abou Al Hool Al Seiahi, Giza 12557 Egypt","Located 300 metres from Great Sphinx, 1.1 km from Giza Pyramids. We offer clean and safe accommodation with free WiFi, air conditioning and a stunning view from the rooftop of the Pyramids and Sphinx. Also we offer tailored tours and trips to all important sites around Egypt.",Giza
Aracan Pyramids Hotel,3.5,"EGP 1,191","Family rooms,Non-smoking rooms,Hair dryer,Complimentary toiletries,Clothes rack,VIP room facilities,Telephone,Seating area,Bath / shower,Flatscreen TV,Refrigerator,Minibar,Safe,Room service,Housekeeping,Air conditioning,Ironing service,Self-serve laundry,Laundry service,Dry cleaning,24-hour front desk,Shops,Non-smoking hotel,Concierge,Baggage storage,BBQ facilities,Meeting rooms,Car hire,Shuttle bus service,Breakfast buffet,Restaurant,Coffee shop,Outdoor pool,Hot bath,Wifi,Street parking,Paid public parking nearby,Banquet room,Business Centre with Internet Access,Airport transportation,Children Activities (Kid / Family Friendly),Bar / lounge,Pool,Free High Speed Internet (WiFi),Free parking,","198 Pyramids St, Oula Al Haram, Giza 12111 Egypt","On the land of pharaohs where they built the pyramids and only 10 minutes away, Horizon Pyramids Hotel is there brand new and built proudly aside to this wonder, in which most of the rooms have a pyramids view. And only 20 minutes away from down town, you can visit the most magnificent sightseeing in Cairo. Not only that, it’s just 7 KM away from the world famous Egyptian Museum with its innumerable ancient artifacts and, of course, the ‘must see’ incomparable Tutankhamun death mask and other relics. Horizon Pyramids Hotel is a hotel that can offer you a new perspective on your destination and on the way you can see all things around you",Giza
Horus Guest House Pyramids View,4.5,"EGP 1,135","Non-smoking rooms,Landmark view,City view,Hair dryer,Bath / shower,Sofa bed,Flatscreen TV,Tile / marble floor,Private bathrooms,Bottled water,Wardrobe / wardrobe,Telephone,Seating area,Walk-in shower,Extra long beds,Cable / satellite TV,Refrigerator,Safe,Housekeeping,Air conditioning,Blackout curtains,Laundry service,Private check-in / check-out,Express check-in / check-out,24-hour front desk,Sun terrace,Sun deck,Shops,Shared lounge / TV area,Outdoor furniture,Mosquito net,Gift shop,Concierge,Taxi service,Outdoor dining area,Complimentary welcome drink,Breakfast available,Coffee shop,Bar / lounge,Internet,Street parking,24-hour check-in,24-hour security,Rooftop terrace,Airport transportation,Patio,Free breakfast,Free High Speed Internet (WiFi),Free parking,","21 Gamal Abdelnasser St Nazlet El Samman - Al Haram - Pyramids, Giza 00202 Egypt","Welcome to Horus Guest House Pyramids View, your Giza “home away from home.” Horus Guest House Pyramids View aims to make your visit as relaxing and enjoyable as possible, which is why so many guests continue to come back year after year.Free internet access is offered to guests, and rooms at Horus Guest House Pyramids View offer air conditioning.While in Giza, you may want to check out some of the restaurants that are a short walk away from Horus Guest House Pyramids View, including 139 Lounge Bar & Terrace (0.9 mi), Felfela (1.1 mi), and Restaurant El Dar Darak (0.2 mi).During your visit, be sure to check out popular attractions like Pyramids of Giza (0.6 mi), Great Pyramid of Cheops (Khufu) (0.6 mi), and Great Sphinx (0.3 mi), which are all within walking distance of the guest house.Horus Guest House Pyramids View puts the best of Giza at your fingertips, making your stay both relaxing and enjoyable.",Giza
Swiss Inn Nile Hotel,3.5,"EGP 1,006","Smoking rooms available,Family rooms,Suites,Non-smoking rooms,Bridal suite,Flatscreen TV,Minibar,VIP room facilities,Safe,Room service,Air conditioning,Laundry service,Dry cleaning,Express check-in / check-out,24-hour front desk,ATM on site,Sun terrace,Shops,Non-smoking hotel,Newspaper,Gift shop,Concierge,Baggage storage,BBQ facilities,Rooftop terrace,Meeting rooms,Banquet room,Car hire,Shuttle bus service,Poolside bar,Special diet menus,Snack bar,Breakfast in the room,Breakfast buffet,Breakfast available,Restaurant,Bar / lounge,Outdoor pool,Rooftop pool,Wifi,Secured parking,Conference facilities,Business Centre with Internet Access,Airport transportation,Children Activities (Kid / Family Friendly),Free breakfast,Pool,Free High Speed Internet (WiFi),Paid private parking nearby,","110, El Bahr El Aazem Street Corniche El Nile, Giza 21017 Egypt","Welcome to Swiss Inn Nile Hotel, your Giza “home away from home.” Swiss Inn Nile Hotel aims to make your visit as relaxing and enjoyable as possible, which is why so many guests continue to come back year after year.Given the close proximity to The Egyptian Renaissance Sculpture (1.9 mi), guests of Swiss Inn Nile Hotel can easily experience one of Giza's most popular landmarks.Rooms at Swiss Inn Nile Hotel provide a flat screen TV, air conditioning, and a minibar, and guests can stay connected with free wifi.In addition, while staying at Swiss Inn Nile Hotel guests have access to 24 hour front desk, room service, and a rooftop terrace. You can also enjoy a rooftop pool and free breakfast. Need a place to park? Parking is available at Swiss Inn Nile Hotel.While in Giza be sure to experience nearby Mediterranean restaurants such as La Gourmandise, 300 Ice Cream, or Semsema.If you are interested in exploring Giza, check out a , such as Great Sphinx.Swiss Inn Nile Hotel puts the best of Giza at your fingertips, making your stay both relaxing and enjoyable.",Giza
3 Pyramids View Inn,5.0,,"Kitchenette,Air conditioning,Currency exchange,Concierge,Baggage storage,Rooftop terrace,Airport transportation,Internet,Free airport transportation,Children Activities (Kid / Family Friendly),Golf course,Bicycle rental,Free breakfast,Fitness Centre with Gym / Workout Room,Hot bath,Free High Speed Internet (WiFi),","3 Pyramids View Inn 7 Abou Al Hool Al Seiahi Al Haram, Giza 12557 Egypt",فندق مطل على منطقة الاهرامات يمتاز بالخدمه ٢٤/٧ وجميع الغرف مكيفه وبها تلفاز ويوجد لدينا خبير سياحى يعد لك برامج الزيارات لجميع انحاء مصر,Giza
Pyramids Park Resort,3.0,"EGP 1,905","Smoking rooms available,Suites,Non-smoking rooms,Flatscreen TV,Minibar,Safe,Room service,Air conditioning,Laundry service,Dry cleaning,24-hour front desk,Currency exchange,Meeting rooms,Poolside bar,Breakfast buffet,Breakfast available,Restaurant,Bar / lounge,Outdoor pool,Paid wifi,Concierge,Baggage storage,Banquet room,Conference facilities,Airport transportation,Free breakfast,Pool,Wifi,","Cairo - Alexandria Desert Road, Giza 12411 Egypt","Pyramids Park Resort Cairo 476 rooms and suites is considered a heaven in a unique landscape of greenery, offering leisure and business travelers a memorable experience amidst a comfortable and relaxing 25 acres of lush gardens and exotic rare plants. location in front of the great Egyptian museum (opening 2018)close to the region s most amazing sights. The Resort is only 5 min away from the Great Pyramids of Giza and the Sphinx , and only 30 min away from the Egyptian Museum, the Citadel. A little farther but also worthwhile are Khan el-Khalili, Egypt s oldest market, the Museum of modern Egyptian art. The smart village and Dandy mall are only 16 Km 20 minutes driving , ,23 Km from Mall of Arabia 30 min driving , Mall of Egypt ( under construction ) is only 17 Km , 20 min driving and 4 KM from Pyramids road.",Giza
Isis Guest House,4.5,EGP 759,,"Abd Al Aziz Al Basel Street Afify Building 4, Giza Egypt","we had a good stay, the staff is smiling and helpful (Imad, Françoise, Ahmed and Hani). the view is great from the room on the pyramids. if you need help to visit the pyramids ask Imad he will help you. thank you for all the Isis guest house team",Giza
B&w Sahara Sky Camp,5.0,"EGP 3,513","Air conditioning,Restaurant,","Al Wahat Al Bahriya - Al Farafra Road Al Wahat Al Bahriya, Al Farafra Desert, Giza 12935 Egypt","Startlingly starry camp in the endless expanses of sand, sky, and mountains in the black desert; one of the last remaining places to experience true wilderness on earth. An eco-friendly designed hotel not fighting against the harsh environment but instead embracing it.",Giza
Helnan Dreamland Hotel,4.0,"EGP 4,837","Smoking rooms available,Family rooms,Suites,Non-smoking rooms,Minibar,VIP room facilities,Safe,Room service,Air conditioning,Ironing service,Laundry service,Dry cleaning,24-hour front desk,ATM on site,Shops,Newspaper,Gift shop,Concierge,Baggage storage,24-hour security,Massage,Spa,Meeting rooms,Banquet room,Conference facilities,Business Centre with Internet Access,Car hire,Snack bar,Breakfast buffet,Breakfast available,Restaurant,Coffee shop,Sauna,Fitness / spa changing rooms,Outdoor pool,Pool / beach towels,Hot bath,Wifi,Secured parking,Airport transportation,Children Activities (Kid / Family Friendly),Table tennis,Bar / lounge,Fitness Centre with Gym / Workout Room,Pool,Free High Speed Internet (WiFi),Paid private parking on-site,","Wahat Road 6th of October City, Giza Egypt","Everyone needs a place to lay their weary head. For travelers visiting Giza, Helnan Dreamland Hotel is an excellent choice for rest and rejuvenation. Guest rooms offer amenities such as a flat-screen TV, air conditioning, and a minibar, and guests can go online with free wifi offered by the hotel. Sheraton Dreamland Hotel features a 24-hour front desk, room service, and a concierge, to help make your stay more enjoyable. The property also boasts a pool and breakfast. If you are driving to Helnan Dreamland Hotel, secured parking is available. Should time allow, the Great Sphinx is popular that is relatively easy to get to. Whether you’re traveling for business, pleasure, or both, Helnan Dreamland Hotel is sure to make your visit to Giza one worth remembering.",Giza
Horizon Shahrazad Hotel,3.0,"EGP 2,199","Suites,Complimentary toiletries,Wake-up service / alarm clock,Clothes rack,Telephone,Bath / shower,Extra long beds,Refrigerator,Minibar,Safe,Room service,Housekeeping,Air conditioning,Ironing service,Express check-in / check-out,24-hour front desk,Shared lounge / TV area,Newspaper,Concierge,Baggage storage,Car hire,Shuttle bus service,Breakfast buffet,Restaurant,Wifi,Paid public parking nearby,Meeting rooms,Business Centre with Internet Access,Airport transportation,Children Activities (Kid / Family Friendly),Babysitting,Free breakfast,Free High Speed Internet (WiFi),Valet parking,","182 Corniche Nile St. El Agouza, Giza Egypt","Hosting a central location in Cairo, this hotel is located by the Nile bank and has an impressive view of the river and Cairo Tower. Free WiFi is available in all areas. Horizon Shahrazad Hotel provides services for your immediate convenience. You can also dine or have a drink at the hotel's bar and restaurant. Horizon Shahrazad Hotel is near a number of landmarks.",Giza
Nine Pyramids View Hotel,3.0,"EGP 1,705","Air conditioning,Restaurant,","2 st, Mohamed Hassab Salam, Mansoria, Haram, Giza 12557 Egypt",Hotel,Giza
St. George Hotel,3.0,EGP 745,"Smoking rooms available,Family rooms,Suites,Non-smoking rooms,Wake-up service / alarm clock,Iron,Clothes rack,Complimentary toiletries,Bath / shower,Refrigerator,Telephone,Room service,Housekeeping,Desk,Air conditioning,Breakfast available,Restaurant,Public wifi,Street parking,Laundry service,Dry cleaning,24-hour front desk,Baggage storage,Meeting rooms,Bar / lounge,Free High Speed Internet (WiFi),Free parking,","7 Radwan Ebn El-Tabib Street, Giza Egypt","See why so many travellers make St. George Hotel their hotel of choice when visiting Giza. Providing an ideal mix of value, comfort and convenience, it offers an array of amenities designed for travellers like you.Rooms at St. George Hotel offer a refrigerator, air conditioning, and a desk providing exceptional comfort and convenience, and guests can go online with free wifi.24 hour front desk and baggage storage are some of the conveniences offered at this hotel. A lounge will also help to make your stay even more special. If you are driving to St. George Hotel, free parking is available.Close to The Egyptian Renaissance Sculpture (2.1 mi), a popular Giza landmark, St. George Hotel is a great destination for tourists.Travellers looking to enjoy some falafel can head to Gad Restaurants. Otherwise, you may want to check out a seafood restaurant such as Hamada Fish, Abou Ghaly Seafood Restaurant, or Wadi El Nil.Best of all, St. George Hotel makes it easy to experience some great Giza attractions like Great Pyramid of Cheops (Khufu), which is a popular architectural building.We’re sure you’ll enjoy your stay at St. George Hotel as you experience all of the things Giza has to offer.",Giza
Pyramids Gem Plaza,5.0,"EGP 3,012","Non-smoking rooms,City view,Bath / shower,Extra long beds,Flatscreen TV,Microwave,Dishwasher,Coffee / tea maker,Private bathrooms,Air conditioning,24-hour front desk,First aid kit,Non-smoking hotel,24-hour security,Rooftop terrace,Free High Speed Internet (WiFi),","4 Rawadat El Ahram Street, Al Remaya, Giza 19999 Egypt","Situated in Cairo, 2.4 km from Giza Pyramids and 3.4 km from Great Sphinx, Pyramids GEM Plaza features accommodation with free WiFi, air conditioning, a shared lounge and a terrace. All units come with a seating area, a sofa, a flat-screen TV with satellite channels and a fully equipped kitchen with a dining area. A microwave, a fridge and oven are also available, as well as a kettle.",Giza
Royal Pyramids Hotel,3.0,EGP 629,"Family rooms,Non-smoking rooms,Refrigerator,Minibar,Room service,Dry cleaning,Non-smoking hotel,Meeting rooms,Restaurant,Wifi,","85 King Faisal Street, Giza 42111 Egypt","The Hotel has 80 luxurious rooms and an outstanding Terrace with all kinds of Food and Beverages served. We are located near the Pyramids which can take only 5 minutes to reach them. Our main aim is to serve our guest at the highest level of satisfaction, and this is fulfilled by our experienced staff. Then we come to be Unique, in all the Pyramids area, in the way we designed our rooms. The rooms were mainly designed to more suite Families or even just a Couple; for their interior wide space in rooms, bathrooms, and even the reception. We also serve various kind of delicious meals in a unique and professional way to satisfy our guests which will surely make them come again. Middle East Hotel Welcomes any Guest of any Nationality.",Giza
Pyramids Empire Inn,4.5,EGP 315,"Smoking rooms available,Family rooms,Non-smoking rooms,Landmark view,Mountain view,Refrigerator,Minibar,Wake-up service / alarm clock,Tile / marble floor,Private bathrooms,Bottled water,Seating area,Room service,Bath / shower,Extra long beds,Cable / satellite TV,Coffee / tea maker,Housekeeping,Air conditioning,Air purifier,Blackout curtains,Ironing service,Self-serve laundry,Laundry service,Dry cleaning,Express check-in / check-out,24-hour front desk,24-hour check-in,Umbrella,Doorperson,Sun terrace,Sun deck,Shared bathroom,Picnic area,Outdoor furniture,Outdoor fireplace,Currency exchange,Concierge,Chapel / shrine,Baggage storage,BBQ facilities,24-hour security,Rooftop terrace,Meeting rooms,Conference facilities,Taxi service,Car hire,Airport transportation,Pets Allowed ( Dog / Pet Friendly ),Children Activities (Kid / Family Friendly),Indoor play area for children,Snack bar,Outdoor dining area,Kids' meals,Kid-friendly buffet,Complimentary welcome drink,Complimentary tea,Breakfast in the room,Breakfast available,Rooftop bar,Restaurant,Children's television networks,Kids stay free,Walking tours,Horseback riding,Free breakfast,Hot bath,Free High Speed Internet (WiFi),Free parking,","Zawya Abou Muslim, Mansuriya Road Near to Sultan Mosque, Giza 12841 Egypt","I had a triple room with private shower. There was a tv table and a couple of chairs. Bathroom had a hot water heater. But our mini fridge is stocked with water and chocolate bars consumable at a minimum charge. So for me it was complete with everything I needed. You wouldn’t think that this place is just minutes away from the Giza pyramids. Either by horse or car it’s right there practically. Yes it’s so tranquil, away from city noise especially with the horses. They’re so serene and calming. So it’s the perfect place if u want something quiet and secluded almost felt like a retreat house yet very close to the desert and pyramids.   Staff is most attentive starting with Ali who always let me know that I can call him anytime. He’s there 24/7 unless he’s out on an errand. Sharif was very helpful with my sunrise ride in Giza desert and in teaching me some Arabic. Owners are very personable and hospitable. They serve a delicious Turkish coffee at a minimum charge. Ahmed their stable boy has a beautiful smile. I luv what I call the community room. People gathered there to talk or watch tv including the owners. When I stayed there, a couple of other female guests and I would meet  either here or right beside it where they had a couple of outdoor wooden couches by the corral.   Note that internet is weak, towels are smaller and breakfast is very simple but at least they are provided. Some places in Giza charge for towels (eg Draz etc). You have a choice between a room with a private shower and toilet or use the shared facilities. Be sure to turn on the heater before u shower or water will be a tad cold.   Luved the rooftop terrace. It is spacious. There is a beautiful view from there both at day and night. You can eat there, just enjoy the view out pray whatever u want. Waking up with horses onsite was a welcome experience for me. I’d luv to stay here again if I had the opportunity to return to Cairo. Thank u pyramids empire inn!…",Giza
Golden Pyramids Inn,4.0,"EGP 1,116","Bottled water,Safe,Sun terrace,Free High Speed Internet (WiFi),Free private parking nearby,","7 Abu Elhol Syahi St., Giza 12557 Egypt","This is a budget b&b hotel and you should not expect, whistles, bells, etc. There are many stairs and no lift. It is super situated for not only a great view of the pyramids from the roof terrace, access to the Sphynx and pyramids is almost across the road. WiFi - can be iffy. The staff are helpful and friendly. This hotel would have had a higher star rating, based on above, but one feature ruined the stay and star rating! I don't know how many rooms have interconnecting doors, but ours did. Room 101 has a locked inter-connecting door with room 102. You can hear everything in room 102 that goes on, including zipping of suitcases, very loudly and clearly.  Obviously this works both ways. Whilst the hotel cannot in any way be responsible for selfish, unthinking, self opinionated a*****s that book a room; they are responsible for the interconnecting doors. These doors should be replaced with a proper sound insulated wall. Having d****s knocking on doors, talking loudly both in their room and in corridors, laughing, unzipping suitcases, and anything else they do in the early hours can be clearly heard through interconnecting doors. We had a very poor experience in this department and had disturbed sleep every night. This has damaged the star rating.…",Giza
The Lotus Guest House,5.0,EGP 896,,"5 Abd El-Aaty Street, Giza 12155 Egypt","We had a perfect stay here with my wife. Franco, the owner, is a veey easygoing man, very flexible, he has a lot of good offers and tours and he doesnt push you to do anything.  We felt very comfortable here and we will repeat in the future!!  Thank you all!!",Giza
Jana Pyramids View Inn,5.0,EGP 377,,"15 Sharie Abw Fayid Nazalah Alsamaan Amam Kubri Eafifi Mahatah Misheal Alharam, Giza 12557 Egypt","Excellent location, just 5 minutes from the pyramid in a clean room, with delicious breakfast and a roof terrace with views over the Pyramids. The family are lovely and I would highly recommend. We have spent almost 2 months travelling in Egypt and this is by far the best place we've stayed (super comfy mattresses!).",Giza
Holidays Express Hotel,3.0,"EGP 1,282","Smoking rooms available,Suites,Non-smoking rooms,City view,Complimentary toiletries,Flatscreen TV,Electric kettle,Wake-up service / alarm clock,Private bathrooms,Wardrobe / wardrobe,Telephone,Seating area,Safe,Room service,Bath / shower,Cable / satellite TV,Minibar,Interconnected rooms available,Housekeeping,Desk,Air conditioning,Bathrobes,Laundry service,Dry cleaning,Express check-in / check-out,24-hour front desk,24-hour check-in,Shops,Concierge,Baggage storage,Meeting rooms,Banquet room,Car hire,Breakfast buffet,Breakfast available,Paid wifi,Wifi,24-hour security,Spa,Conference facilities,Business Centre with Internet Access,Airport transportation,Restaurant,Fitness Centre with Gym / Workout Room,Free internet,","2 Gamaat El Dowal El Arabia Street Sphinx Square, Mohandessin, Giza 11511 Egypt","Offering comfortable and spacious guest rooms, Holidays Express Hotel is well situated in Cairo’s cosmopolitan district of Mohandessin, within walking distance from excellent restaurants and shops. Choose from a variety of rooms and suites at Holidays Express Hotel to suit your needs. Each one is well-presented and features satellite TV and air conditioning. Enjoy international and Oriental cuisine at Holidays Express Hotel’s restaurant or grab a quick bite to eat at the cosy café. Keep up with your health routine at the well-equipped fitness center and afterwards, enjoy a sauna and a massage. There are plenty of restaurants and shops nearby and Holidays Express Hotel is well-connected to the rest of Cairo with good public transport links. We speak your language!",Giza
