Hotel Names,Ratings,Number of Reviews,Prices,links,location,Description
123. Crown Hotel,3.5 of 5 bubbles,30 reviews,"EGP 2,016",https://www.tripadvisor.in/Hotel_Review-g294201-d17668019-Reviews-Crown_Hotel-Cairo_Cairo_Governorate.html,"16 Gawad Housney Downtown, Cairo 11511 Egypt","Located in Cairo and with Tahrir Square reachable within 1.4 km, Crown Hotel provides express check-in and check-out, non-smoking rooms, a bar, free WiFi and a shared lounge. Featuring room service, this property also provides guests with a casino. The accommodation offers a 24-hour front desk, a shared kitchen and currency exchange for guests. At the hotel, each room is fitted with a balcony. At Crown Hotel every room is fitted with a desk, a flat-screen TV and a private bathroom. A continental breakfast is available daily at the accommodation. For business travellers' convenience, meeting and banquet facilities, a business centre, a fax machine and photocopier and an ATM machine are featured. Khan Al Khalili is 1.7 km from Crown Hotel, while Al-Azhar Mosque is 2.1 km away. The nearest airport is Cairo International, 18 km from the hotel, and the property offers a paid airport shuttle service. Your property description is created according to the facilities and amenities you add"
124. Jewel Green Mountain Hotel,3.5 of 5 bubbles,4 reviews,"EGP 1,810EGP 1,677",https://www.tripadvisor.in/Hotel_Review-g294201-d23249025-Reviews-Jewel_Green_Mountain_Hotel-Cairo_Cairo_Governorate.html,"19 Green Mountain Buildings, Nasr Road Nasr City, Next to Queen Service Company, Cairo 11511 Egypt","Not only is the hotel bad, it's the whole customer experience, hotel facilities are horrible, food is unbelievable, staff, room, everything calls you to escape the hotel. Internet wifi does not work all the time.  Breakfast restaurant welcomes you with an awful smell. The room is unbelievable, The water in the shower is just a small drops of water. And believe me, you don’t want to sniff bathroom’s aroma. !!  The bed mattress is very old and curved which causes unbearable back pain."
125. New President Hotel Zamalek,3.5 of 5 bubbles,26 reviews,"EGP 2,983",https://www.tripadvisor.in/Hotel_Review-g294201-d4714351-Reviews-New_President_Hotel_Zamalek-Cairo_Cairo_Governorate.html,"20 Taha Hussein St., Cairo 11511 Egypt","New President Hotel Zamalek is an excellent choice for travellers visiting Cairo, offering a budget friendly environment alongside many helpful amenities designed to enhance your stay.As your “home away from home,” the small hotel rooms offer air conditioning and a minibar, and getting online is easy, with free wifi available.Guests have access to 24 hour front desk, room service, and express check-in and check-out while staying at New President Hotel Zamalek. In addition, New President Hotel Zamalek offers a lounge, which will help make your Cairo trip additionally gratifying.Close to some of Cairo's most popular landmarks, such as St. Mark's Coptic Orthodox Church (2.9 mi) and Heliopolis (3.0 mi), New President Hotel Zamalek is a great destination for tourists.If you like French restaurants, New President Hotel Zamalek is conveniently located near The Smokery Heliopolis, La Maison Blanche, and Le Carnaval.If you are looking for something to do in the area, Khan Al-Khalili (1.0 mi) is a popular attraction that is within walking distance of New President Hotel Zamalek.Enjoy your stay in Cairo!"
Fairmont Nile City,4.5 of 5 bubbles,"5,393 reviews","EGP 4,838",https://www.tripadvisor.in/Hotel_Review-g294201-d580690-Reviews-Fairmont_Nile_City-Cairo_Cairo_Governorate.html,"Nile City Towers - 2005 B, Corniche El Nil Ramlet Beaulac, Cairo 2466 Egypt","A melting pot of history and diversity, the city of Cairo is ideal for both business and leisure. Like the city itself, Fairmont Nile City offers a delightful series of contrasts, combining advanced technology and modern design with local flavors and flair. With sweeping panoramas of the river Nile and the Pyramids in the distance, Cairo’s beauty and history are always in sight from your luxury accommodation. During your stay, embark on culinary adventures at the city’s finest restaurants, enjoy the fresh air at our rooftop poolside restaurant and pamper yourself at Willow Stream Spa. Part of the prestigious Nile City complex, this luxury hotel is the perfect location for business events. The space consists of 845 square meters (9,100 square feet) plus 450 square meters (4,800 square feet) of outdoor space dedicated to meetings and conventions, comprising of 10 meeting rooms including a ballroom. The space also offers spectacular river Nile views."
126. Hostgram Hostel,4.5 of 5 bubbles,120 reviews,"EGP 1,154",https://www.tripadvisor.in/Hotel_Review-g294201-d13923569-Reviews-Hostgram_Hostel-Cairo_Cairo_Governorate.html,"2 Marouf, Downtown, First floor., Cairo 11511 Egypt","For us hosting is an art that we’d love to share, so don’t miss it. Our rooms: A minimum of 16 m² space. Inside bathrooms with hot water. Clean bed sheets and towels to be replaced each morning. T.V. Facilities: 24 hour front desk. English speaking staff. Info desk. Well equipped kitchen free to use. Free & safe storage room. Free Egyptian or continental breakfast, served each morning."
127. Sun Hotel,4 of 5 bubbles,28 reviews,EGP 743,https://www.tripadvisor.in/Hotel_Review-g294201-d1203426-Reviews-Sun_Hotel-Cairo_Cairo_Governorate.html,"2 Talaat Harb Street Tahrir Square, Cairo 11511 Egypt","I stayed for 7 nights at Sun Hotel. The place looks much better than you could expect after the photos on tripadvisor. Rooms are simple, but clean. I took a cheaper option - with no A/C and shared bathroom and it was more than ok. Bathrooms are being cleaned few times a day, the water is warm. Some of the rooms have a great view to Tahrir Square - ask, if they are available. The biggest advantage of the hotel is the location - walking distance (5 min.) from the Egyptian Museum, close to the Nile, next to the metro station. The staff can speak english and are really helpful."
128. Talisman Hotel,4 of 5 bubbles,207 reviews,"EGP 2,948",https://www.tripadvisor.in/Hotel_Review-g294201-d602877-Reviews-Talisman_Hotel-Cairo_Cairo_Governorate.html,"39 Talaat Harb Downtown, Cairo 11511 Egypt","Talisman Hotel de Charme is an excellent choice for travellers visiting Cairo, offering a charming environment alongside many helpful amenities designed to enhance your stay.While staying at Talisman Hotel, visitors can check out Mosque of Al-Azhar (0.5 mi) and Zamalek (Gezira Island) (1.0 mi), some of Cairo's top attractions.Guest rooms offer amenities such as a flat screen TV, a minibar, and air conditioning, and guests can go online with free wifi offered by the hotel.Talisman Hotel de Charme features room service and a concierge, to help make your stay more enjoyable. The property also boasts free breakfast.While visiting Cairo, you may want to try some crab at one of the nearby restaurants, such as Saigon Restaurant & Lounge.Cairo is also known for some great historic sites, including Saqqara (Sakkara) Pyramids, Mohamed Ali Mosque, and Citadel (Al-Qalaa), which are not too far from Talisman Hotel Cairo.Enjoy your stay in Cairo!"
129. New City Suites & Apartments,3 of 5 bubbles,23 reviews,"EGP 1,483",https://www.tripadvisor.in/Hotel_Review-g294201-d5616188-Reviews-New_City_Suites_Apartments-Cairo_Cairo_Governorate.html,"39 Chark Insurance Compound, Cairo 11511 Egypt",Beating heart of new cairo. Facing the American university. Only real aparthotel in the 5th Settlement-newcairo. Awarded excellence award by Egyptian tourism board of independent hotels.
130. Happy City Hotel,3 of 5 bubbles,56 reviews,EGP 878,https://www.tripadvisor.in/Hotel_Review-g294201-d1017536-Reviews-Happy_City_Hotel-Cairo_Cairo_Governorate.html,"92 C Mohamed Farid St, Abdin Sq, Cairo 11511 Egypt","Welcome to Happy City Hotel, your Cairo “home away from home.” Happy City Hotel aims to make your visit as relaxing and enjoyable as possible, which is why so many guests continue to come back year after year.Nearby landmarks such as Mosque of Al-Azhar (0.1 mi) and Zamalek (Gezira Island) (1.0 mi) make Happy City Hotel a great place to stay when visiting Cairo.The rooms offer air conditioning, and getting online is possible, as free wifi is available, allowing you to rest and refresh with ease.Happy City Hotel features 24 hour front desk, room service, and a sun terrace. In addition, as a valued Happy City Hotel guest, you can enjoy a lounge that is available on-site. Guests arriving by vehicle have access to paid public parking available nearby.While in Cairo be sure to experience local shrimp favourites at Kadoura Fish Restaurant, Birdcage, or Abou el-Sid.There is no shortage of things to do in the area: explore popular monuments and statues such as Alabaster Sphinx, 360 EgypTours, and Obelisk of Ramses II.Happy City Hotel puts the best of Cairo at your fingertips, making your stay both relaxing and enjoyable."
Sofitel Cairo Nile El Gezirah,4.5 of 5 bubbles,"3,918 reviews","EGP 5,122",https://www.tripadvisor.in/Hotel_Review-g294201-d304481-Reviews-Sofitel_Cairo_Nile_El_Gezirah-Cairo_Cairo_Governorate.html,"3 El Thawra Council St Zamalek, Cairo Egypt","On the southern tip of Gezirah Island, the hotel is a corner of paradise in central Cairo, minutes from Cairo’s business districts. Discover a haven of peace during a vacation in Egypt, and a comfortable base to rest after a successful day of business. Relax by the pool, pamper yourself in Sofitel SPA, wine and dine in our international restaurants and bars. Surrender to luxury and come for a day, a weekend, a week…or more. A stroll along the hotel’s lush riverside promenade takes you to a host of acclaimed restaurants and bars. You can take your time, enjoying the cool shade of exotic palms and breathing in the scent of hibiscus. You’ll hear the gentle sound of water lapping as you rest on a Nile-side terrace with a cool drink, and dine on international cuisine. It’s especially beautiful at dusk, when the sun sets over Cairo’s skyline and vibrant nightlife. Escape the city for a day at our secluded Cairo hotel, which feels like an exclusive Egyptian resort set in lush gardens. Take advantage of Sofitel SPA and Sofitel FIT, float in an infinity pool overlooking the Nile, unwind in a bubbling whirlpool bath… whatever you desire. Day membership includes discounts to the restaurants and bars which line the Nile-side promenade, promising refreshment and fun for families, couples and friends."
131. Grand Palace Hotel,3.5 of 5 bubbles,10 reviews,"EGP 1,393",https://www.tripadvisor.in/Hotel_Review-g294201-d15619172-Reviews-Grand_Palace_Hotel-Cairo_Cairo_Governorate.html,"14 Shamplion St. ,Downtown, Cairo 11511 Egypt",This place is dirty AF. 5 star reviews must be paid for. Bed sheets dirty with hair and blood 🩸 stains. Dirty walls. Couldn’t even hook my fire stick up 2 the pathetic tv. Wi-Fi is trash 🗑.  Most ppl staying here look like locals who may not have much money. Didn’t even bother with breakfast since the room was dirty. Staff entered my room to fix some broken lights right when trying to eat dinner. Got bit up by something that left nasty marks. Book airbnb instead for ur stay and tours.
132. Garden Season Hotel,5 of 5 bubbles,3 reviews,"EGP 1,992",https://www.tripadvisor.in/Hotel_Review-g294201-d21507280-Reviews-Garden_Season_Hotel-Cairo_Cairo_Governorate.html,"8 Ibrahim Naguib Garden City, Cairo 11511 Egypt","I don’t recommend that place at all… they didn’t honor any booking was made on booking.com after I arrived with my family and my little kids they said that my booking is exist but they don’t have any available rooms because my booking was made on booking.com, it wasn’t only me, there were two more families sitting in the reception facing the same issue. Worst hotel in Egypt . Don’t ever book there or waste your time with them."
133. Beirut Hotel,3 of 5 bubbles,35 reviews,"EGP 1,806EGP 1,524",https://www.tripadvisor.in/Hotel_Review-g294201-d559403-Reviews-Beirut_Hotel-Cairo_Cairo_Governorate.html,"56 Beirut St. Heliopolis, Cairo 11511 Egypt","Finding an ideal budget friendly hotel in Cairo does not have to be difficult. Welcome to Beirut Hotel, a nice option for travellers like you.Rooms at Beirut Hotel offer air conditioning providing exceptional comfort and convenience, and guests can go online with free internet access.24 hour front desk, room service, and a gift shop are some of the conveniences offered at this hotel. A fitness center and free breakfast will also help to make your stay even more special. If you are driving to Beirut Hotel, there is free public parking available nearby.Close to some of Cairo's most popular landmarks, such as St. Mark's Coptic Orthodox Church (0.3 mi) and Egyptian Air Force Museum (1.2 mi), Beirut Hotel is a great destination for tourists.While in Cairo, you may want to check out some of the restaurants that are a short walk away from Beirut Hotel, including Tivoli Dome (0.9 mi), Sachi Restaurant (0.6 mi), and Pepenero (0.6 mi).During your visit, be sure to check out popular attractions like Saqqara (Sakkara) Pyramids (0.6 mi), Heliopolis (0.4 mi), and Baron Palace (0.1 mi), which are all within walking distance of the hotel.Beirut Hotel puts the best of Cairo at your fingertips, making your stay both relaxing and enjoyable."
134. Grand City Hotel,4.5 of 5 bubbles,8 reviews,"EGP 1,061",https://www.tripadvisor.in/Hotel_Review-g294201-d21089015-Reviews-Grand_City_Hotel-Cairo_Cairo_Governorate.html,"3 Bostan Ibn Al Quraish, Cairo 12424 Egypt","Boasting a terrace and views of city, Grand City Hotel is situated in Cairo, 700 metres from The Egyptian Museum. Among the facilities at this property are room service and a concierge service, along with free WiFi throughout the property. The accommodation features a 24-hour front desk, a shared kitchen and currency exchange for guests. All rooms are fitted with air conditioning, a flat-screen"
135. Invitation Hotel,3.5 of 5 bubbles,79 reviews,EGP 697,https://www.tripadvisor.in/Hotel_Review-g294201-d606812-Reviews-Invitation_Hotel-Cairo_Cairo_Governorate.html,"11 Ramsis Street Abdelmonem Riyad Sq, Cairo 11511 Egypt","See why so many travellers make Invitation Hotel their hotel of choice when visiting Cairo. Providing an ideal mix of value, comfort and convenience, it offers a budget friendly setting with an array of amenities designed for travellers like you.Guest rooms offer amenities such as air conditioning, and guests can go online with free wifi offered by the hotel.Invitation Hotel features a concierge and room service, to help make your stay more enjoyable. The property also boasts an on-site restaurant.Given the close proximity of popular landmarks, such as St. Mark's Coptic Orthodox Church (0.5 mi) and Obelisk of Ramses II (1.6 mi), guests of Invitation Hotel can easily experience some of Cairo's most well known attractions.Cairo has plenty of cafes. So when you’re here, be sure to check out popular spots like Bosco Cafe and Restaurant, Fresco, and Cafe Med, which are serving up some great dishes.Cairo is also known for some great architectural buildings, including Khan Al-Khalili, Citadel (Al-Qalaa), and Hanging Church (El Muallaqa, Sitt Mariam, St Mary), which are not too far from Invitation Hotel.We’re sure you’ll enjoy your stay at Invitation Hotel as you experience all of the things Cairo has to offer."
"Staybridge Suites Cairo - Citystars, an IHG Hotel",4.5 of 5 bubbles,234 reviews,"EGP 4,825",https://www.tripadvisor.in/Hotel_Review-g294201-d1150283-Reviews-Staybridge_Suites_Cairo_Citystars_an_IHG_Hotel-Cairo_Cairo_Governorate.html,"Emtedad Makram Obied Street Heliopolis, Cairo 11737 Egypt","Modern serviced apartments for extended stays in dynamic Cairo Citystars. Offering the comfort and convenience of a home away from home, Staybridge Suites® Cairo Citystars has everything you need for independent living in the exciting commercial hub of Heliopolis. With direct access to Stars Centre shopping mall, and just a seven-minute drive from Cairo International Airport and Cairo International Convention and Exhibition Centre, our 140 fully furnished studios and suites place travelers where they need to be. The buzzing streets of downtown Cairo are half an hour away, with the Great Pyramids a little further. Business travelers on extended stays in Cairo can settle into a spacious studio or suite with up to three bedrooms. Full kitchens and living areas let you cook, work and entertain in style, and Wi-Fi is complimentary throughout. A free buffet breakfast sets you up for the day, and an Evening Social invites you to mingle with fellow guests over dinner three nights a week."
136. Jewel Dokki Hotel,4 of 5 bubbles,1 review,"EGP 2,617",https://www.tripadvisor.in/Hotel_Review-g294201-d21510868-Reviews-Jewel_Dokki_Hotel-Cairo_Cairo_Governorate.html,"11 El Batal Ahmed Abd El-Aziz, Mohandessin, Cairo 99999 Egypt","Un très agréable endroit , à première vue j’imaginais pas trouver un tel confort. C’est un hôtel nouvellement créé, il a ouvert ses portes en Juillet 2020 , il appartient à l’Etat   On était très bien accueillis moi et ma petite famille. Ils nous ont donné une suite composée de 2 chambres chacune avec télé et climatisation  il y’a aussi une kitchenette et une douche  La literie est confortable et l’hôtel dispose d’un restaurant qui offre une variété de plats  Le prix est très intéressant  L’emplacement est aussi intéressant   Je recommande vivement cet hôtel"
137. Maxim Hotel,4 of 5 bubbles,13 reviews,"EGP 1,808EGP 1,591",https://www.tripadvisor.in/Hotel_Review-g294201-d3846972-Reviews-Maxim_Hotel-Cairo_Cairo_Governorate.html,"5 El Senaah St. Off Abbas El Akkad St. Nasr City, Cairo 11511 Egypt","Central location, close to everything, but on a quiet street. The staff was very helpful and accommodating. They are renovating the hotel, so some of the rooms are brand new and spacious. Good breakfast. Has wifi. Recommended!"
138. Nile Sky Suites Hotel,4 of 5 bubbles,4 reviews,"EGP 1,965",https://www.tripadvisor.in/Hotel_Review-g294201-d17662327-Reviews-Nile_Sky_Suites_Hotel-Cairo_Cairo_Governorate.html,"137 Abdulaziz AL Saud Street, Cairo 11451 Egypt",Rooms are big with a great view. Friendly staff. I stayed there twice. Breakfast box was ready at 5 am as I had two early departures. Wifi is a bit slow. For this room rate you can't get a better view. Also good location on the river and close to Tahrir Square.
139. Isis Hotel 2,4.5 of 5 bubbles,31 reviews,"EGP 1,035EGP 847",https://www.tripadvisor.in/Hotel_Review-g294201-d3819974-Reviews-Isis_Hotel_2-Cairo_Cairo_Governorate.html,"10 Mohamed Helmy Ibrahim from Shampollion St Downtown, Cairo 13333 Egypt","Isis Hotel 2 just opened last January, 2013."
140. New Panorama Hotel,5 of 5 bubbles,1 review,EGP 980,https://www.tripadvisor.in/Hotel_Review-g294201-d17793120-Reviews-New_Panorama_Hotel-Cairo_Cairo_Governorate.html,"42 Talaat Harb 6th Floor, Down Town, Cairo 11956 Egypt","I stayed in this hotel twice during my Egypt tour. The hotel is located in the Talaat Harb area (city center) of Cairo city and within 1 km of the of the Cairo museum (old one at Tahrir square). Khane-Kahlil and Al-Azhar mosque areas are not too far. The owner and the staffs (Ms Wafa and Mr. Amun) of the hotel were very friendly.  Rooms and the building were ole and very basic, bathroom had hot water. Clean room/bathroom. Breakfast was provided."
"InterContinental Citystars Cairo, an IHG Hotel",4.5 of 5 bubbles,"2,549 reviews","EGP 6,470",https://www.tripadvisor.in/Hotel_Review-g294201-d536381-Reviews-InterContinental_Citystars_Cairo_an_IHG_Hotel-Cairo_Cairo_Governorate.html,"Omar Ibn El Khattab Street Heliopolis, Cairo 11737 Egypt","Explore Cairo's heritage amidst modern luxuries and stay at the five-star InterContinental Citystars Cairo hotel in Cairo's Heliopolis, next to Stars Centre Mall. Relax in grand rooms with beautiful furnishings and views. Indulge at our 10 exquisite restaurants and bars. Need event space? Our private meeting rooms and Egypt's largest ballroom will satisfy your requirements. Our concierge gladly arranges private tours of the nearby Cairo Citadel, the Pyramids, and soon, The Grand Egyptian Museum."
141. Grand Lyly Hotel,3.5 of 5 bubbles,8 reviews,EGP 737EGP 684,https://www.tripadvisor.in/Hotel_Review-g294201-d12536907-Reviews-Grand_Lyly_Hotel-Cairo_Cairo_Governorate.html,"19 Adly, Al Fawalah, Downtown, Cairo 11511 Egypt","Grand Lyly Hotel is an excellent choice for travellers visiting Cairo, offering many helpful amenities designed to enhance your stay.Close to some of Cairo's most popular landmarks, such as Mosque of Al-Azhar (0.5 mi) and Zamalek (Gezira Island) (1.0 mi), Grand Lyly Hotel is a great destination for tourists.Guest rooms offer amenities such as air conditioning, a minibar, and a sofa.Cairo has plenty of Mediterranean restaurants. So when you’re here, be sure to check out popular spots like Sequoia, Nile Maxim, and Blue Nile, which are serving up some great dishes.Plus, during your trip, don't forget to check out a castle, such as Bab Zuweila.Enjoy your stay in Cairo!"
142. Cairo Plaza Hotel,3 of 5 bubbles,5 reviews,EGP 849,https://www.tripadvisor.in/Hotel_Review-g294201-d19258468-Reviews-Cairo_Plaza_Hotel-Cairo_Cairo_Governorate.html,"6 Bank Misr Street Off Sherif St., Front of the Central Bank of Egypt, 3rd Floor, Cairo 11511 Egypt","Located in Cairo and with Tahrir Square reachable within an 18-minute walk, Cairo Plaza Hotel has a tour desk, rooms, a shared lounge, free WiFi throughout the property and a terrace. The property is around a 20-minute walk from Khan Al Khalili, 2.1 km from Al-Azhar Mosque and 2.7 km from The Egyptian Museum. The property provides a 24-hour front desk, a shared kitchen and currency exchange for gu"
143. City Hotel,3 of 5 bubbles,24 reviews,"EGP 1,061EGP 853",https://www.tripadvisor.in/Hotel_Review-g294201-d12331289-Reviews-City_Hotel-Cairo_Cairo_Governorate.html,"162 El-tahrir st., Cairo 11511 Egypt","The City Hotel is situated in the center of Cairo, less than a 1-minute walk from the Egyptian Museum and Tahrir Square. In addition to convenient restaurants such as KFC or the famous oriental restaurant Felfela, several banks, embassies, and Metro stations are all within walking distance. The property is within a 5-minute walk to the Jewish temple and many other places of worship. The hotel offers elegant rooms with free Wi-Fi and has a restaurant that serves regional cuisine. For the comfort of the guests' room at this hotel is air conditioned and comes with a TV with satellite channels, a mini-bar, and a safety deposit box. Each room has a private bathroom fitted with a shower. All rooms at the hotel feature a city-view balcony. A complimentary breakfast is served daily which includes fresh fruits, vegetables, cheeses, breads, and eggs cooked to order. With a little advance notice upon your arrival, trips to destinations that you chose (according to a schedule of your choosing) can be arranged. Laundry service is also provided upon request. You will find a 24-hour front desk at the property. Khan Al Khalili is 1 km from the City Hotel, while Muizz Street is 2 km away. The nearest airport is Cairo International Airport, 16 km away."
144. Colour Holidays,2 of 5 bubbles,3 reviews,EGP 491,https://www.tripadvisor.in/Hotel_Review-g294201-d13121576-Reviews-Colour_Holidays-Cairo_Cairo_Governorate.html,"26 Shibeen Street, Cairo Egypt","Welcome to Colour Holidays, your Cairo “home away from home.” Colour Holidays aims to make your visit as relaxing and enjoyable as possible, which is why so many guests continue to come back year after year.While staying at Colour Holidays, visitors can check out Mosque of Syeda Zainab (2.5 mi) and Khan Al-Khalili (2.9 mi), some of Cairo's top attractions.The rooms offer a fireplace, extra long beds, and a seating area, and getting online is possible, as free wifi is available, allowing you to rest and refresh with ease.Colour Holidays features 24 hour front desk, room service, and baggage storage. In addition, as a valued Colour Holidays guest, you can enjoy an on-site restaurant that is available on-site. Guests arriving by vehicle have access to free parking.Travellers looking to enjoy some ribs can head to The Tap Maadi. Otherwise, you may want to check out an Asian restaurant such as Le Peking Zamalek, Sabai Sabai Thailand Restaurant, or The Karvin Hotel.If you are interested in exploring Cairo, check out one of the art museums, such as Gayer-Anderson Museum (Bayt al-Kiritliya), The Coptic Museum, and Museum of Islamic Arts.Colour Holidays puts the best of Cairo at your fingertips, making your stay both relaxing and enjoyable."
145. Jewel Sports City and Aqua Park,2.5 of 5 bubbles,65 reviews,"EGP 2,733",https://www.tripadvisor.in/Hotel_Review-g294201-d7744510-Reviews-Jewel_Sports_City_and_Aqua_Park-Cairo_Cairo_Governorate.html,"Al Zahraa Nassr City, Cairo 11511 Egypt","In New Cairo at Al Zahraa , Nasr City district, just 4 Km away from Cairo International Airport, TOLIP Sports City Resort & Spa has luxurious rooms with a magnificent terrace. It features an outdoor swimming pool, Aqua Park, Health club & Spa , 6 restaurants and bars, wide variety of sport activities, cinema and seven fully equipped conference and banquet halls"
