name,ratings,prices,aminities,location,description,City
Hyatt Regency Cairo West,5.0,"EGP 5,932","Smoking rooms available,Suites,Non-smoking rooms,Pool view,Private bathrooms,Iron,Wardrobe / wardrobe,Telephone,Electric kettle,Safe,Room service,Interconnected rooms available,Housekeeping,Air conditioning,Soundproof rooms,Allergy-free room,Ironing service,Laundry service,Dry cleaning,24-hour front desk,24-hour check-in,Doorperson,ATM on site,Shared lounge / TV area,Currency exchange,Concierge,Baggage storage,24-hour security,Massage,Spa,Meeting rooms,Banquet room,Airport transportation,Kids pool,Kids club,Children Activities (Kid / Family Friendly),Indoor play area for children,Wine / champagne,Outdoor dining area,Complimentary Instant Coffee,Breakfast buffet,Breakfast available,Restaurant,Sauna,Babysitting,Kids stay free,Billiards,Bar / lounge,Fitness Centre with Gym / Workout Room,Pool,Free High Speed Internet (WiFi),Paid private parking on-site,","KM 22 Cairo-Alexandria Desert RD Pyramids Heights Business Park, Giza 8655 Egypt","Perfect hotel, Lovely place, Healthy food. #1 hotel for me  Pool with heated water  Huge room in terms of space Hygiene and very clean Variety on everything food, drink, music  Really from my side, it’s hotel # 1 on Giza region ",Giza
Great Pyramid INN,4.5,,"Smoking rooms available,Family rooms,Non-smoking rooms,Bridal suite,City view,Mountain view,Hair dryer,Complimentary toiletries,Bath / shower,Sofa bed,Radio,Flatscreen TV,Wake-up service / alarm clock,Tile / marble floor,Private bathrooms,Clothes rack,Bottled water,Wardrobe / wardrobe,Telephone,Sofa,Seating area,Safe,Room service,Private balcony,Housekeeping,Soundproof rooms,Walk-in shower,Extra long beds,Cable / satellite TV,Electric kettle,Dining area,Air conditioning,Blackout curtains,Allergy-free room,Shoeshine,Ironing service,Washing machine,Laundry service,Private check-in / check-out,Express check-in / check-out,24-hour front desk,First aid kit,Sun terrace,Shops,Outdoor furniture,Currency exchange,Concierge,Baggage storage,24-hour security,Taxi service,Car hire,Walking tours,Special diet menus,Snack bar,Outdoor dining area,Kids' meals,Complimentary welcome drink,Complimentary tea,Complimentary Instant Coffee,Breakfast available,Restaurant,Wifi,Rooftop terrace,Photo copier / fax In business centre,Airport transportation,Evening entertainment,Horseback riding,Free breakfast,Free High Speed Internet (WiFi),Street parking,","14 Abou Al Hool Street, Giza Egypt","The Great Pyramid Inn Amidst in the first line opposite the Great Pyramids of Giza and Sphinx. The hotel located just a couple of more minutes walking distance from these wonders entrance gate, 30 minutes away driving from Saqqara Pyramid and the Egyptian Museum. Seek after secret gates of the ancient world through pharonic decorations in the hotel corridors, discover our unparalleled view of the pyramids while enjoying the magnificent sunrise or sunset plus free sound and light show from terrace restaurant and explore a new exceptional journey through history where Egyptian heritage meets luxurious European hospitality. It is the idyllic hideaway for sightseeing and relaxation. Kindly be informed that we provide free pick up service from the airport but only if you have two days reservation at least.",Giza
Hyatt Regency Cairo West,5.0,"EGP 5,932","Smoking rooms available,Suites,Non-smoking rooms,Pool view,Private bathrooms,Iron,Wardrobe / wardrobe,Telephone,Electric kettle,Safe,Room service,Interconnected rooms available,Housekeeping,Air conditioning,Soundproof rooms,Allergy-free room,Ironing service,Laundry service,Dry cleaning,24-hour front desk,24-hour check-in,Doorperson,ATM on site,Shared lounge / TV area,Currency exchange,Concierge,Baggage storage,24-hour security,Massage,Spa,Meeting rooms,Banquet room,Airport transportation,Kids pool,Kids club,Children Activities (Kid / Family Friendly),Indoor play area for children,Wine / champagne,Outdoor dining area,Complimentary Instant Coffee,Breakfast buffet,Breakfast available,Restaurant,Sauna,Babysitting,Kids stay free,Billiards,Bar / lounge,Fitness Centre with Gym / Workout Room,Pool,Free High Speed Internet (WiFi),Paid private parking on-site,","KM 22 Cairo-Alexandria Desert RD Pyramids Heights Business Park, Giza 8655 Egypt","Perfect hotel, Lovely place, Healthy food. #1 hotel for me  Pool with heated water  Huge room in terms of space Hygiene and very clean Variety on everything food, drink, music  Really from my side, it’s hotel # 1 on Giza region ",Giza
Best View Pyramids Hotel,4.5,"EGP 1,537","Smoking rooms available,Family rooms,Suites,Non-smoking rooms,Bridal suite,Hair dryer,Complimentary toiletries,Sofa bed,Refrigerator,Microwave,Dishwasher,Telephone,Seating area,Safe,Bath / shower,Extra long beds,Flatscreen TV,Coffee / tea maker,Room service,Private balcony,Housekeeping,Air conditioning,Shoeshine,Ironing service,Washing machine,Laundry service,Dry cleaning,Clothes dryer,Private check-in / check-out,24-hour front desk,24-hour check-in,Doorperson,Sun terrace,Currency exchange,Concierge,Baggage storage,24-hour security,Car hire,Shuttle bus service,Airport transportation,Rooftop bar,Restaurant,Bar / lounge,Wifi,Rooftop terrace,Hot spring bath,Free airport transportation,Children Activities (Kid / Family Friendly),Bicycles available,Free breakfast,Free High Speed Internet (WiFi),Free parking,","13 Gamal Abd Nasser Street, Giza 12561 Egypt","Best View Pyramids Hotel is an excellent choice for travellers visiting Giza, offering a romantic environment alongside many helpful amenities designed to enhance your stay.You’ll enjoy relaxing rooms that offer a flat screen TV, a refrigerator, and air conditioning, and you can stay connected during your stay as Best View Pyramids Hotel offers guests free wifi.The hotel features a rooftop terrace and room service. Plus, Best View Pyramids Hotel offers free breakfast, providing a pleasant respite from your busy day. For guests with a vehicle, free parking is available.If you like shawarma, Best View Pyramids Hotel is conveniently located near Felfela, which is known for serving up this local favourite.If you’re looking for something to do, Pyramids of Giza (0.6 mi), Great Pyramid of Cheops (Khufu) (0.6 mi), and Great Sphinx (0.3 mi) are a nice way to spend some time, and they are all within walking distance of Best View Pyramids Hotel.Enjoy your stay in Giza!",Giza
Steigenberger Pyramids Cairo,4.5,"EGP 21,437","Smoking rooms available,Family rooms,Suites,Non-smoking rooms,Pool view,Hair dryer,Complimentary toiletries,Bath / shower,Walk-in shower,Flatscreen TV,Electric kettle,Private bathrooms,Iron,Bottled water,Wardrobe / wardrobe,VIP room facilities,Telephone,Seating area,Safe,Room service,Private balcony,Bidet,Cable / satellite TV,Minibar,Housekeeping,Desk,Air conditioning,Bathrobes,Blackout curtains,Ironing service,Laundry service,Dry cleaning,24-hour front desk,24-hour check-in,Doorperson,Concierge,24-hour security,Spa,Meeting rooms,Banquet room,Car hire,Poolside bar,Outdoor dining area,Complimentary welcome drink,Complimentary tea,Complimentary Instant Coffee,Breakfast buffet,Breakfast available,Restaurant,Bar / lounge,Outdoor pool,Wifi,Secured parking,Conference facilities,Business Centre with Internet Access,Airport transportation,Children Activities (Kid / Family Friendly),Free breakfast,Pool,Free High Speed Internet (WiFi),Paid private parking on-site,","Alexandria Road Pyramids, Giza 11511 Egypt","Footsteps away from the Great Pyramids of Giza, the Steigenberger Pyramids Cairo is where the glamorous history of Egypt and its world famous hospitality meet. The hotel is the perfect starting point for sightseeing, relaxation and business meetings alike, featuring elegantly appointed rooms and suites, two swimming pools and a variety of bars and restaurant",Giza
Safir Hotel Cairo,4.5,"EGP 6,304","Smoking rooms available,Family rooms,Suites,Non-smoking rooms,Flatscreen TV,Minibar,Bottled water,VIP room facilities,Safe,Room service,Private balcony,Air conditioning,Shoeshine,Ironing service,Laundry service,Dry cleaning,24-hour front desk,Doorperson,ATM on site,Shops,Newspaper,Gift shop,Currency exchange,Concierge,Baggage storage,BBQ facilities,24-hour security,Steam room,Salon,Massage,Spa,Meeting rooms,Banquet room,Conference facilities,Business Centre with Internet Access,Taxi service,Car hire,Kids' meals,Kid-friendly buffet,Breakfast in the room,Breakfast buffet,Restaurant,Coffee shop,Bar / lounge,Sauna,Fitness / spa changing rooms,Outdoor pool,Pool / beach towels,Hot bath,Wifi,Airport transportation,Kids stay free,Evening entertainment,Free breakfast,Fitness Centre with Gym / Workout Room,Pool,Free High Speed Internet (WiFi),Paid public parking nearby,","El Missaha Square, Giza Egypt","Finding an ideal hotel in Giza does not have to be difficult. Welcome to Safir Hotel Cairo, a nice option for travellers like you.For those interested in checking out Pharaonic Village (2.6 mi) while visiting Giza, Safir Hotel Cairo is a short distance away.You’ll enjoy relaxing rooms that offer a flat screen TV, a minibar, and air conditioning, and you can stay connected during your stay as Safir Hotel Cairo offers guests free wifi.The hotel features 24 hour front desk, room service, and a concierge. Plus, Safir Hotel Cairo offers a pool and free breakfast, providing a pleasant respite from your busy day. For guests with a vehicle, there is paid public parking available nearby.If you’re looking for a Mexican restaurant, consider a visit to Vinni Cafe & Deli, which is not far from Safir Hotel Cairo.Giza is also home to Great Sphinx, a popular  that is not too far from Safir Hotel Cairo.Safir Hotel Cairo looks forward to welcoming you on your visit to Giza.",Giza
Pyramids View Inn,4.5,EGP 808,"Family rooms,Suites,Non-smoking rooms,Landmark view,Hair dryer,Complimentary toiletries,Electric kettle,Refrigerator,Wake-up service / alarm clock,Private bathrooms,Clothes rack,Bottled water,Safe,Bath / shower,Cable / satellite TV,Coffee / tea maker,Room service,Private balcony,Housekeeping,Air conditioning,Blackout curtains,Laundry service,24-hour front desk,Umbrella,First aid kit,Sun terrace,Gift shop,Concierge,Baggage storage,Taxi service,Airport transportation,Complimentary welcome drink,Complimentary tea,Complimentary Instant Coffee,Breakfast available,Rooftop bar,Coffee shop,Wifi,Street parking,24-hour check-in,24-hour security,Rooftop terrace,Free airport transportation,Walking tours,Free breakfast,Free High Speed Internet (WiFi),Free public parking nearby,","10 sphinx streets, pyramids Giza Front of Sphinx Entrance Gate, Next to KFC and Pizza Hut. At the Sound & Light Show Square, Giza 1212 Egypt","with free airport transfer . at the historical area of the pyramids of Giza The Only Hotel with Balcony Facing the 3 pyramids and The Great sphinx , pyramids , Giza,the nearest location to the pyramids of Giza,only 300 feet from The pyramids and front of The entrance Gate and Roof top sitting With The Best View ,All rooms with air condition and (hot & cold water), living room with American kitchen and balcony overlooking the Sphinx. The rooms, furnished with an elegant and luxurious wooden ceilings and marble floors, offer the most modern standards. Each room has quality fittings, air conditioning, TV color satellite, ISDN fast internet connection, direct dial telephone. All rooms are equipped with emergency lighting.",Giza
"Marriott Mena House, Cairo",4.5,"EGP 17,621","Smoking rooms available,Family rooms,Suites,Non-smoking rooms,Bridal suite,Pool view,Landmark view,Hair dryer,Flatscreen TV,Electric kettle,Refrigerator,Minibar,Wake-up service / alarm clock,Private bathrooms,Iron,Clothes rack,Bottled water,VIP room facilities,Telephone,Safe,Room service,Private balcony,Bath / shower,Cable / satellite TV,Coffee / tea maker,Housekeeping,Desk,Air conditioning,Bathrobes,Blackout curtains,Ironing service,Laundry service,Dry cleaning,24-hour front desk,24-hour check-in,Doorperson,Butler service,ATM on site,Shops,Gift shop,Executive lounge access,Currency exchange,Concierge,Baggage storage,24-hour security,Massage,Foot bath,Facial treatments,Couples massage,Body wrap,Spa,Meeting rooms,Banquet room,Taxi service,Poolside bar,Breakfast in the room,Breakfast buffet,Breakfast available,Restaurant,Sauna,Fitness / spa changing rooms,Heated pool,Outdoor pool,Pool / beach towels,Hot bath,Public wifi,Conference facilities,Car hire,Walking tours,Bar / lounge,Fitness Centre with Gym / Workout Room,Pool,Free internet,Valet parking,","6 Pyramids Road, Giza 12556 Egypt","Marriott Mena House, Cairo comprises 331 luxury rooms and suites, many boasting views of the Pyramids, the lavish gardens or the swimming pool, four restaurants and lounges, expansive indoor and outdoor meetings and banquet facilities, a heated swimming pool and a health club. Discover our unparalleled and unique hotel in Cairo, Egypt.",Giza
Four Seasons Hotel Cairo at the First Residence,4.5,"EGP 11,102","Smoking rooms available,Family rooms,Suites,Non-smoking rooms,Flatscreen TV,Minibar,Iron,Safe,Room service,Private balcony,Air conditioning,Ironing service,Laundry service,Dry cleaning,24-hour front desk,Doorperson,Butler service,Shops,Currency exchange,Concierge,Baggage storage,24-hour security,Steam room,Salon,Massage,Facial treatments,Spa,Meeting rooms,Banquet room,Conference facilities,Business Centre with Internet Access,Taxi service,Airport transportation,Poolside bar,Breakfast in the room,Breakfast buffet,Breakfast available,Restaurant,Sauna,Fitness / spa changing rooms,Heated pool,Outdoor pool,Pool / beach towels,Wifi,Babysitting,Kids stay free,Casino and Gambling,Bar / lounge,Fitness Centre with Gym / Workout Room,Pool,Free High Speed Internet (WiFi),Parking,","35 Giza Street, Giza 12311 Egypt","Stay in the heart of Cairo, with breathtaking views to enchant you and ancient zoological and botanical gardens just outside your door. At our luxury boutique hotel, enjoy an array of authentic fine dining outlets, lavish spa and opulent meeting spaces, an adjacent designer mall and a casino. Just minutes away from the hotel enjoy the best of the city's arts, culture and shopping areas.",Giza
Barcelo Cairo Pyramids,4.0,"EGP 2,712","Family rooms,Suites,Non-smoking rooms,Flatscreen TV,Minibar,Safe,Room service,Housekeeping,Air conditioning,Ironing service,Self-serve laundry,Laundry service,Dry cleaning,24-hour front desk,Currency exchange,Concierge,Baggage storage,24-hour security,Rooftop terrace,Massage,Spa,Meeting rooms,Banquet room,Rooftop bar,Poolside bar,Breakfast in the room,Breakfast buffet,Restaurant,Bar / lounge,Sauna,Outdoor pool,Rooftop pool,Paid wifi,Parking,Conference facilities,Business Centre with Internet Access,Taxi service,Free breakfast,Fitness Centre with Gym / Workout Room,Pool,Wifi,Free parking,","229 Al Haram Street, Giza 12111 Egypt","Just off Sharia Al Haram avenue, this upscale hotel is 6 km from Giza metro station and 8 km from the Giza Plateau, home to the royal pyramids and the Great Sphinx. Elegant rooms come with free Wi-Fi, satellite TV and safes. Upgrades add views of the pyramids, while suites include lounges and kitchenettes. Room service is available. There are 3 modern restaurants; 1 serves Italian fare and another has a terrace with panoramic views. Other amenities include a 24-hour bar, as well as a shisha bar next to the heated outdoor pool. There's also a gym, along with a sauna and a spa where massages are available. Parking is free.",Giza
Pyramids Planet Hotel,5.0,,"Family rooms,Suites,Non-smoking rooms,City view,Mountain view,Hair dryer,Complimentary toiletries,Bath / shower,Walk-in shower,Flatscreen TV,Electric kettle,Stovetop,Oven,Microwave,Dishwasher,Wake-up service / alarm clock,Tile / marble floor,Private bathrooms,Iron,Bottled water,Telephone,Separate living room,Safe,Room service,Private balcony,Bidet,Extra long beds,Cable / satellite TV,Coffee / tea maker,Housekeeping,Desk,Air conditioning,Blackout curtains,Shoeshine,Ironing service,Washing machine,Laundry service,Dry cleaning,Clothes dryer,Private check-in / check-out,24-hour front desk,24-hour check-in,Sun terrace,Shared lounge / TV area,Shared kitchen,Shared bathroom,Outdoor furniture,Non-smoking hotel,Newspaper,Mosquito net,Executive lounge access,Currency exchange,Concierge,Baggage storage,24-hour security,Taxi service,Car hire,Shuttle bus service,Complimentary welcome drink,Complimentary tea,Complimentary Instant Coffee,Breakfast in the room,Breakfast available,Restaurant,Wifi,Street parking,Rooftop terrace,Airport transportation,Children Activities (Kid / Family Friendly),Evening entertainment,Entertainment staff,Free breakfast,Free High Speed Internet (WiFi),Free parking,","198 W, Hadayek El Ahram, Gate 2, Giza 12513 Egypt","Pyramids Planet Hotel features air-conditioned rooms with satellite flat-screen TV in the Giza district of Cairo. Boasting a 24-hour front desk, this property also welcomes guests with a restaurant and a terrace. Private parking is available on site. The private bathroom is fitted with a shower, a hairdryer and free toiletries. All rooms at the hotel are fitted with a shared bathroom equipped with a bath. - Free WIFI is available inside all the property ** Rooms ( Many of them with Pyramids View ) with good facilities Such as Private bathroom with Hairdryer , Air condition ,Dry Cleaning, Ironing service, Daily housekeeping, Fax and Photocopying and Pharmacy. Giza Pyramids is 701 m from the accommodations, while Great Sphinx is 0.8 mi from the property. The nearest airport is Sphinx International Airport, 17 mi from Pyramids Planet Hotel. Home away from Home !!",Giza
Egypt Pyramids Inn,4.5,"EGP 3,915","Non-smoking rooms,Room service,Air conditioning,Laundry service,Rooftop terrace,Airport transportation,Children Activities (Kid / Family Friendly),Restaurant,Free breakfast,Internet,Free High Speed Internet (WiFi),","1 Abou Al Hool Al Seiahi, Giza 12557 Egypt","Nice place. Fantastic view and workers are nice. They also arrange a tour to visit the pyramids and the national museum. The guide was good. After check out, they  borrowed me a room to take a shower before going to the airport. Food is also good.",Giza
Elite Pyramids Boutique Hotel,5.0,,"Family rooms,Suites,Non-smoking rooms,Pool view,Mountain view,Hair dryer,Complimentary toiletries,Minibar,Room service,Air conditioning,Restaurant,Shuttle bus service,Airport transportation,Bar / lounge,Free breakfast,Pool,Wifi,Free High Speed Internet (WiFi),Free parking,","5 Hadayek Alahram, Alharam Street Beheind Christo Restaurant, Giza 12556 Egypt","Located in Cairo, 700 m from Giza Pyramids, Elite Pyramids Boutique Hotel features accommodation with a restaurant, free private parking, an outdoor swimming pool and a bar. Among the facilities at this property are a shared lounge and an ATM, along with free WiFi throughout the property. The accommodation offers a 24-hour front desk, room service and currency exchange for guests.",Giza
Sheraton Cairo Hotel & Casino,4.0,"EGP 6,479","Smoking rooms available,Family rooms,Suites,Non-smoking rooms,Bridal suite,Pool view,Landmark view,City view,Hair dryer,Flatscreen TV,Electric kettle,Wake-up service / alarm clock,Private bathrooms,Clothes rack,Bottled water,Wardrobe / wardrobe,VIP room facilities,Sofa,Separate living room,Separate dining area,Seating area,Safe,Room service,Private balcony,Interconnected rooms available,Bath / shower,Cable / satellite TV,Minibar,Housekeeping,Dining area,Desk,Air conditioning,Bathrobes,Shoeshine,Ironing service,Laundry service,Dry cleaning,Express check-in / check-out,24-hour front desk,24-hour check-in,Doorperson,ATM on site,Outdoor furniture,Newspaper,Gift shop,Currency exchange,Convenience store,Concierge,Baggage storage,24-hour security,Massage,Spa,Meeting rooms,Banquet room,Conference facilities,Business Centre with Internet Access,Taxi service,Car hire,Airport transportation,Poolside bar,Outdoor dining area,Kids' meals,Kid-friendly buffet,Happy hour,Breakfast in the room,Breakfast buffet,Breakfast available,Restaurant,Coffee shop,Sauna,Personal trainer,Fitness classes,Fitness / spa changing rooms,Yoga room,Outdoor pool,Pool / beach towels,Wifi,Paid private parking on-site,Highchairs available,Nightclub / DJ,Casino and Gambling,Bar / lounge,Fitness Centre with Gym / Workout Room,Pool,Free High Speed Internet (WiFi),Valet parking,","Galae Square, Giza 11511 Egypt","Sheraton Cairo Hotel & Casino sits on the west bank of the River Nile in Cairo, Egypt, in unique adjoining towers that place you in the middle of it all. Come and try your hand at blackjack in our casino, relax in our comfortable accommodations and explore the area around our hotel which includes Cairo Opera House, Egyptian Museum and Cairo shopping centers.",Giza
Pyramisa Suites Hotel Cairo,3.5,"EGP 4,705","Family rooms,Suites,Non-smoking rooms,Flatscreen TV,Safe,Room service,Private balcony,Air conditioning,Laundry service,Dry cleaning,Meeting rooms,Banquet room,Breakfast buffet,Restaurant,Bar / lounge,Outdoor pool,Wifi,Doorperson,Concierge,Conference facilities,Business Centre with Internet Access,Free breakfast,Fitness Centre with Gym / Workout Room,Pool,Free High Speed Internet (WiFi),","60 Giza Street, Dokki, Giza 12611 Egypt","Welcome to Pyramisa Suites Hotel Cairo, your Giza “home away from home. Pyramisa Suites Hotel Cairo aims to make your visit as relaxing and enjoyable as possible, which is why so many guests continue to come back year after year. Given the close proximity to Pharaonic Village (2.8 mi), guests of Pyramisa Cairo Hotel can easily experience one of Giza's most popular landmarks. Guest rooms offer a flat screen TV and air conditioning, and Pyramisa Suites Hotel Cairo makes getting online easy as free wifi is available. You can also take advantage of some of the amenities offered by the hotel, including room service and a concierge. In addition, guests can enjoy a pool and free breakfast during their visit. If you are looking for a good seafood restaurant, you may want to check out Hamada Fish, Abou Ghaly Seafood Restaurant, or Wadi El Nil while staying at Pyramisa Suites Hotel Cairo. Giza is also known for some great history museums, including The Grand Egyptian Museum, Egypt Travel Gate Day Tours, and Taha Hussein Museum, which are not too far from Pyramisa Suites Hotel Cairo. Pyramisa Suites Hotel Cairo puts the best of Giza at your fingertips, making your stay both relaxing and enjoyable.",Giza
Sahara Pyramids Inn,4.5,,"Suites,Room service,Housekeeping,Air conditioning,Restaurant,Shuttle bus service,Airport transportation,Pets Allowed ( Dog / Pet Friendly ),Bar / lounge,Free breakfast,Wifi,Free High Speed Internet (WiFi),Free parking,","14 Abou Al Hool Street In Front of the Entrance of Sound and Light, Giza 12556 Egypt","Sahara pyramids inn Amidst in the first line opposite the great pyramids of giza and sphinx The hotel located just a couple of more minutes walking distance from these wonders entrance gate , 30 minutes away driving from saqqara Pyramid and the Egyptian Museum. Seek after secret gates of the ancient world through pharonic decorations in hotel corridors, discover our unparalleled view of the pyrami",Giza
Guardian Guest House,4.5,,"Non-smoking rooms,Landmark view,City view,Hair dryer,Complimentary toiletries,Private bathrooms,Bath / shower,Bidet,Coffee / tea maker,Bottled water,Seating area,Housekeeping,Air conditioning,Blackout curtains,Ironing service,Laundry service,Express check-in / check-out,24-hour front desk,24-hour check-in,Sun terrace,Shops,Outdoor furniture,Baggage storage,24-hour security,Car hire,Special diet menus,Complimentary tea,Complimentary Instant Coffee,Breakfast buffet,Internet,Street parking,Rooftop terrace,Shuttle bus service,Children's television networks,Kids stay free,Horseback riding,Free breakfast,Free High Speed Internet (WiFi),Free public parking nearby,","1 Abou Al Hool street Nazlet el Samman, Giza 12561 Egypt",Imagine waking up in the morning to the view of the 3 Pyramids of Giza and their guardian the Sphinx. Guardian Guest House is a charming property located at a throwing distance from the Giza plateau.,Giza
Cairo Pyramids Hotel,3.5,"EGP 23,180","Smoking rooms available,Family rooms,Suites,Non-smoking rooms,Hair dryer,Wardrobe / wardrobe,VIP room facilities,Telephone,Safe,Bath / shower,Flatscreen TV,Minibar,Room service,Private balcony,Housekeeping,Air conditioning,Blackout curtains,Ironing service,Laundry service,Dry cleaning,24-hour front desk,Doorperson,Concierge,Baggage storage,Meeting rooms,Banquet room,Taxi service,Poolside bar,Swimup bar,Breakfast buffet,Breakfast available,Restaurant,Outdoor pool,Wifi,Secured parking,24-hour security,Conference facilities,Business Centre with Internet Access,Airport transportation,Bar / lounge,Pool,Free internet,Paid private parking on-site,","Alexandria Road, Giza 83110 Egypt","Only a short distance from Giza at the foot of the Pyramids lies the Cairo Pyramids Hotel. The hotel is the perfect starting point for sightseeing, relaxation and business meetings alike. With elegantly appointed rooms and suites, two swimming pools and a variety of bars and restaurants to choose from. Both the Garden wing is offering guests a contemporary, convenient and comfortable experience. Just 35 kilometer from downtown and 51 kilometers from Cairo airport and with easy access to the new industrial areas around the city.",Giza
